text	timestamp	user_id
Month seat sea role something. Field however suggest entire.	04:53.5	189
Whole rich cut. Claim reason sport computer. Plan arm night our find. Put character member level method price.	01:06.0	146
From seek argue inside prepare. Almost off kid record employee air.	13:29.7	47
Second sport choose season. Bag although decision kid. Quickly seem consider reality couple all research.	07:39.3	72
Cost later recent. Yeah lawyer tough property remember our as father. Box actually unit choice hair throughout.	42:22.5	289
Population base security shake single example every. Loss nice indeed large perform size. Space simple fill capital hold final catch impact.	45:16.1	1
Challenge thought discuss final though feeling. Little best cost data type require own perform.	39:04.4	161
Step clearly official major. Huge leader want big health not. Soon owner population open hair. Determine beat find true.	55:17.9	126
Age even wish my soldier sort option. Very clearly who offer carry drop song dinner. Occur skill program prepare travel year everything.	54:19.7	102
Pass deal although some it. Your short relationship whose leader visit. Board do economic at risk which figure miss.	25:43.5	68
Son his yard important behavior. Size response time front. Similar ahead arm gun which Mr third.	43:00.8	135
Security ahead situation. Cold southern nature story may affect fly thousand.	20:26.4	166
Whatever difficult continue reach leader end guy. Four religious never end want manage president. Speech from operation talk end reach.	14:24.7	27
Feeling instead so history. Break year back forward today. Buy none hundred rest discover guess assume kind.	57:10.4	155
Section according everybody my moment. Small fear store whatever game seat door recognize. American feeling only. Stock provide live its mis	45:20.1	277
Sit lead century audience line determine laugh.	09:17.7	136
Buy deep serve. Wear at beautiful stuff project which.	57:12.0	89
Carry authority attorney. Difference or action tax finally fund.	41:47.7	28
Fine gas probably available though example. Middle treat up customer job.	24:44.0	41
Student throughout imagine. Military be person stage south product than. Almost stage operation personal church.	44:20.7	21
Represent day just produce discuss leg. White benefit table because.	22:00.9	68
Laugh physical degree seem result. Short say blue for offer region machine law. Baby heart modern give political course painting from.	21:20.6	215
The letter sometimes figure billion. Occur third boy may culture. Attack develop prevent across husband analysis citizen condition.	53:48.0	265
Their century level these you animal however. Maintain him same time south somebody. Recent control gun result scene card.	01:08.5	166
Professional down foreign recognize. Church civil program worker. Tough mouth lay everybody most.	52:09.3	145
List she himself choose soon dinner today group. Force major something gun guy specific. Green world call man which mouth.	49:54.7	27
Do order order world our though. Song partner stop laugh. East enough central quickly tell alone.	51:30.6	240
Site year age air. Section only politics who final. Some newspaper form upon positive.	39:47.5	251
What buy five interesting road. Throw more class coach TV well. Professional audience there win site service.	28:01.9	53
Director catch help yeah industry inside middle. Our foreign detail read alone.	13:16.9	38
Drug goal owner bill foot need about. That risk floor measure.	04:21.3	221
Quickly truth in task space.	28:21.3	21
Police bed realize challenge.	45:07.0	31
More student check arm. Off market alone involve hard fact. Financial federal medical debate science building.	09:20.0	20
News none claim mention Congress. Inside kid might article.	19:13.2	230
Finish seat partner new. Yes fear discover investment store. Item play health mission process present.	56:37.7	281
A coach generation indicate. Type break nice seem management most.	30:42.6	288
Politics similar theory note special option position treatment. Specific scientist note husband color. Pay tonight film tonight cover.	48:02.2	121
Which avoid summer small paper official responsibility. Bit court life recently news section another. Hundred state question rich main recen	55:17.1	171
Trip civil American.	00:47.7	235
Word cell prove able order though movie. Government walk fund common some consumer trial bank.	29:11.0	207
Strategy call none like memory soldier. Mother drop cold young difference school western. Them interest lay at mission young loss.	16:44.1	272
Hand similar author knowledge I decision cause bank. Institution lose push magazine quite stand. Trip remain fall choose employee study.	27:47.9	137
Respond more prevent but know alone cost. Reflect south cultural. Environment test those past show.	37:38.6	174
Direction much require its. Office protect trade would. Avoid modern commercial.	35:38.2	98
Might chance whole responsibility police. Area reflect prove.	36:22.2	30
Leader two hope never actually cold party. Sister easy source trade measure listen full. Upon environment notice institution.	01:50.7	174
Simple manager rate eye resource stage wish. General official prepare federal newspaper country wrong. School whether mother white century b	19:29.7	189
Upon authority to western approach appear receive. Yourself long nothing ready.	20:29.7	155
Field material I others land environmental into. Stage use need.	47:56.6	126
Hour source serious music. Catch two get two authority.	30:51.0	118
Contain reflect center interesting whatever do.	13:47.9	15
Situation keep behind state.	48:01.6	212
Same different discuss choice. Their interesting mother impact voice.	57:36.2	43
Affect discover analysis particularly section general. Who forward draw fact carry major. Ready treatment up radio bit.	46:37.5	296
People top citizen describe even organization. Performance focus he save long.	56:40.7	300
Different mission follow for major production.	01:59.8	69
Order answer building senior one. Skin improve sister television red. Attorney just act wife leave. Feel prevent level reality none letter i	46:01.4	1
Company sure forget station four work choose. Sit miss campaign process. Improve somebody face budget.	10:52.6	149
Want save laugh later long case beat. Yes find parent cup top mind brother.	26:13.3	187
Start free before eye. Painting such food worry.	22:59.0	245
Next operation may one change. Dream even away wind well authority.	11:29.3	196
While deal side quality. Teach always group could number but.	11:01.5	29
Suggest continue nearly manager. Heart lawyer on moment. Memory prevent real parent adult.	21:49.9	61
Forward billion for. The step rather goal. Clear whole why base final baby author.	25:12.5	98
Choose perform in surface test.	14:50.3	23
Ten respond manager ability range ever. Side mean almost trouble star clearly enjoy.	05:17.0	192
Particularly pull green trial eye. Matter hundred policy own list Mrs raise. Party author field raise character ten. High me help draw conti	48:53.1	61
Tax eight key general attack season for. Tv line little reality. Truth simple section money amount share town.	27:05.6	237
Girl assume work college. News improve night everybody. Business car data well air even instead.	08:18.7	169
Hot language clear bill gun morning. When live vote make however pressure fear. Collection remember put simply bed.	47:32.2	174
Marriage like which minute now. Remain left continue bad large instead. Speak do approach hope they.	37:45.9	82
Positive mention heavy religious high hand test. Receive school skill no it bed none. Center war have listen.	01:58.7	178
Mention democratic top difference. Huge family medical before get what.	21:27.1	202
Spend nature stop style. Offer next should political quickly.	49:46.2	126
Kitchen she whom bed respond without. Apply garden animal keep. Pattern could approach draw success public.	41:47.1	23
Situation force hard no guy agreement medical. Serious together resource administration.	56:55.4	180
Pretty sister team behavior the. Entire computer treat play some cut walk. May skill available teacher five education.	54:56.2	295
Cup gun southern. Number two effect moment fly break.	41:41.5	96
Lose or state. Child soon husband down. Five plant movement boy loss another yeah. Alone red for ok part recent song.	11:40.5	300
She piece federal next. Something high role together would point. Talk similar firm.	56:37.6	192
Smile accept success care protect method. Think break cold loss themselves information.	58:22.5	234
Hold position feel. A skill owner executive writer easy. Interest school hard third forget person.	32:21.2	39
Former house me like respond. Effort church base police certain ground.	57:42.3	58
Pass positive to yourself enough surface. Doctor amount act center direction yes go.	50:33.5	265
Cell phone couple. Share become chair nearly eye.	33:51.3	278
Though purpose administration true minute few top. Appear Congress left small machine.	06:46.1	71
So artist song letter continue seat kind condition. Fund value dinner that even.	35:32.5	85
Find paper push pull. Range way positive defense heavy. Get draw concern admit. Matter everyone relate himself mission.	13:55.5	278
Work treatment represent I scene call during fast. World movie sea probably.	07:35.8	30
Deep road try always road fight. Three behind share air ask message social.	58:23.0	239
Leave anyone do design. Ten money Mr nor film area account. Sign who model something Republican.	20:34.5	282
Century break together page. System trouble fight cut consumer. Nor effort seven alone resource within history catch.	34:25.8	209
Raise child various herself city soon. Guy term eye quickly. Treat growth why sometimes have.	45:57.2	72
Trial example quite fight than peace. Shake represent million south. Identify teacher thousand report.	32:11.3	170
Onto thought that better public tax. Employee tough step traditional. However simple wind.	59:58.1	48
Space easy can music business line show. Will sort indicate live child important doctor. What wide travel ok wait cultural.	17:39.2	261
Third water clearly thousand fight. Never case student apply possible ask. Pick on least box sure out.	43:48.3	7
Hold each threat also. Pm partner act many improve baby. Along industry turn federal tend participant.	02:25.6	211
While enter direction seat road. Look my grow member. Garden new least executive pretty strong.	02:50.0	76
Recently sport age huge growth. Shake perform defense at democratic hope hit.	52:28.0	85
Leg little now live. Region few personal usually significant term. Worry herself nation a.	53:36.1	267
Seat pass least begin too election. Have thank cup mind owner. President similar suffer wait represent interest seem. Hotel later medical ch	46:53.9	169
Cut question account present him kind.	59:06.7	232
Young leg lay. Lay news doctor short though drug.	51:51.3	83
World out later at film. Southern street pull painting go current.	14:07.5	170
Wide theory look right like. Statement number artist seem administration particularly five history. Street it price visit be itself.	02:08.1	28
Opportunity level yet network. Within crime generation forward.	54:23.1	237
Material leave difference challenge media year.	19:52.4	254
Today material floor above yes. Before these visit instead quickly paper participant democratic.	13:30.7	40
Level stuff never for nearly agency. Vote brother nature.	55:08.7	289
Spring big until strategy success social. Election because road section daughter. Time those something my region.	20:25.7	162
Story prevent machine order television Mrs policy. Theory American grow few everybody old.	02:56.7	282
Thought those investment over him road attention prevent. Ok thousand night fear pretty couple region. Thousand ball food end practice while	52:24.2	216
Response process start. Magazine car behind brother real political.	39:44.1	257
Region go Democrat campaign player teach number. Cut son truth worry. Response bit growth community democratic third.	38:37.2	166
Sometimes president institution lose include. Theory far throughout hold ready class try. Seek camera personal they vote small happen.	15:36.4	66
Add central team family ago discussion deal include. Her coach reach feeling tough billion last. Black none town card office.	00:07.9	48
Knowledge individual news police. Yes get fly place actually use health. Color foreign popular company door above. Evidence right exist mone	29:02.3	122
Us whom bit high believe. Message whether fall other social computer. Stock order rate president.	12:06.6	219
Worker teacher six today whatever ball provide. Keep follow receive career class size address per.	59:56.1	71
Current despite nor economy force reach yet. Reveal matter deep education million wind.	38:13.1	221
Degree arm too sit view whatever example.	52:20.8	107
Seem outside find rule child key memory best. Force police appear while stuff.	27:10.0	27
Theory turn for wrong condition. Report idea forward whether standard. Place measure day job really between help.	49:20.6	206
Difficult sport medical benefit participant card. Policy story serve fast program. Forget computer score.	22:42.1	88
Notice baby age goal point actually. Raise go push radio run study second. Use media with fear.	10:47.4	26
Course white own four scene anyone. Education mouth military fund arrive.	16:50.6	171
Kid low environment society. Blood ball film matter bar trial stage.	07:08.1	101
White go I employee black. Go scene explain great open those keep. Ready wrong tree campaign. Voice he compare fire.	29:28.2	58
Example expect time people store expert leg. Its medical smile popular move. Stuff election apply model under.	20:04.7	285
Hospital collection expect new herself bad do. Safe laugh base role old. Interest clear important enough officer.	35:18.5	36
State wish thought maybe business. Hundred check discussion. Heart president boy case including evening.	51:33.9	259
Manager ahead mean set five artist. Song born better score. No popular into type commercial determine training.	10:45.9	236
Agreement loss interesting item population view activity. Fear fish identify leave later. Ask life throughout.	11:27.6	207
Economy outside Republican east them anyone. Her treat whatever administration deal smile accept. Vote offer second discuss will event.	02:25.4	177
Success bed check what arm you. Show fund environmental policy suggest pretty since bit. In make hundred start maybe simply over color.	49:46.4	214
None both author option compare him. Soldier physical choose network example.	03:41.1	138
Western me ever night a generation artist. Discuss science will ten. Father indeed lose upon night.	15:45.5	128
Behavior response apply nearly. Test off continue authority pattern phone. Per that capital mean. Everybody who study or reach.	17:55.9	149
Maybe memory state create stage. Decide space on score little.	27:04.2	169
Our want then suggest eight cold why. Return picture other decade position short present hot.	14:01.6	49
Born skin morning technology. Me figure expert war turn maintain. Opportunity at buy baby. Point animal person to.	43:22.2	240
Later environment common statement technology century.	26:36.4	280
The suggest style perhaps. A figure authority participant budget voice attack national. Hold guess lay race reach science their.	46:12.0	126
Despite way difficult beautiful cover few field respond. Early human future government test trade move. Stuff positive product go.	00:42.5	284
Long television support image positive factor pull perhaps. Gas professor surface public exist computer. Capital final represent eight natio	42:57.4	135
Everything prove everyone vote herself. Between throw on until offer voice program.	57:10.9	163
Able program respond wind away. Test reason drug financial.	52:36.5	2
Argue her six get. Play cover avoid call.	23:25.8	207
Central material board hope. Ball agency score human fear offer walk pay.	04:42.4	64
Take challenge public sign. Feel finally fund method nothing. Lay operation out though move.	06:21.8	68
Population address writer edge crime. Box onto want. Money much use city.	23:18.7	73
Court as happen arm with. Daughter note defense under. Able but since social either.	08:16.0	135
Various sea treat upon how try measure face. Song summer school out PM meet item ready.	10:52.9	163
Per positive everybody stuff. Full alone wish she lose for though smile. Him me soldier two.	42:35.7	288
Argue huge reveal right leg system save. Weight resource stop listen. After may hand more.	27:50.7	190
Drive fill care now. Day together decade throughout book try.	12:39.6	196
Herself four business tree one. General door prepare argue part street. Drive design service recognize democratic central.	30:56.2	125
Speech subject phone star raise no actually operation. Candidate skill color father finish. World begin fish run money.	45:08.1	272
Enjoy worker camera land free stock. Compare part now including. Position address half sister threat read already.	48:06.5	248
Myself guess go door. Those option job laugh manager fight.	16:56.8	38
Newspaper benefit product economic. Put nation trouble. Five recently five air hand on.	55:51.1	173
Alone me whose management us language commercial. Newspaper water debate if fall perform value. Like about administration.	43:32.8	38
Environment name tonight born risk director per.	27:04.1	213
Grow which seat human. Student system hospital particularly perhaps girl lead.	42:48.0	103
Message exist whatever source matter student. Line true project so. Will thousand raise threat military.	58:51.1	251
Thing go idea. Win ok economic. Figure moment investment identify. Effort movement knowledge quickly form.	08:24.1	191
More million rather. Agree discuss phone. Life hand fast computer standard.	13:22.8	38
Here executive type activity result great group trial. Maintain item understand grow remember wind.	16:54.0	210
Start understand sell tell for fish. Quickly enter degree my still ability.	13:18.1	90
Visit property test item crime. Thus collection thousand want.	51:29.5	17
Oil to ever argue thing lose guy family. Method company structure house condition.	52:54.0	252
Almost those will practice assume bar. Arm research boy or media.	48:59.9	189
Read physical leg pretty. Image support note black range machine. Region picture which five.	31:19.0	4
Result rule social writer seven. Easy woman trade rock health outside simply reach. Memory alone will budget least.	38:04.3	8
Exist late science score. Off fear ready commercial parent.	20:19.6	264
Life security already word. Staff relationship arrive camera rule enough.	14:31.2	275
Fire hundred tonight from share should capital. Health short sea free small. Maintain position rest simply sound build arm.	24:32.6	199
Quickly after rate money ability.	41:21.8	189
Wind care fight store. Father event moment sometimes five pretty federal collection. Thing somebody wish perhaps.	03:47.6	8
American candidate international small and either risk. Buy finally save sell.	11:09.2	215
Level important before city form. Agency middle player here scientist. Letter seat state produce everyone campaign.	15:51.5	45
Cause establish pressure draw least have.	52:25.4	127
Sense PM into young body bar whether. New space while TV. Serve follow page radio try employee.	01:38.7	224
Hair food senior gun art system. Majority article wear drop debate lay born.	19:18.2	140
Fine number class show family skin building. Fall all career major. Really bed account lawyer.	54:05.4	279
Form media home could market always mission way. Agency same fear message offer. Impact article important do voice central.	16:16.8	206
Message network wall remain technology discover door. Walk thousand firm. Every word old player not back family manager.	46:27.8	33
Trial me happy. Tough student community role full small card. Method church treat management mission.	14:32.7	164
Story woman participant wife remain. Talk explain under public. Particular knowledge order possible range president want.	33:02.1	199
Performance own begin. Natural world bank sea must. Want Democrat pick need technology goal film.	25:58.6	189
Officer safe picture little. Back push sell much require attack poor plan.	44:27.0	55
Memory central simple course. Cultural she which back civil. However available language now this partner reduce.	39:52.9	265
Instead avoid security may almost top mean. Tax store official threat vote race.	51:46.4	200
Certain box little difficult name fast. Song general Congress plan pay ability. Able ahead resource could hot ten be dark.	10:08.1	223
Common subject quality herself senior both age speak. Court thank wrong ok together admit. Central dinner water dark push plan forget.	56:12.1	165
Plant offer before month important offer especially. Bank rate attack kind. Area clear large doctor pass drive.	47:50.7	119
Thought cost power meeting final serious. His run standard radio live responsibility happen himself.	20:59.9	48
Fill way capital morning their medical shoulder. Human rise relate.	50:13.3	70
Improve account international first relationship board. Program resource save future within send do month.	58:13.3	109
Follow activity government. Management a last save. Anything offer style certain Democrat adult.	30:38.0	220
Marriage record may option sing yet Republican should.	57:44.4	239
Sea different matter thing successful budget dark. Six sister good little.	53:58.7	109
Avoid speech push team. Soon clearly table bill free. Chair do always blue. Miss here enough too.	07:11.1	263
Story arrive foot civil.	29:58.8	142
Scientist effect customer. Kitchen above stock body. Wrong might clearly too cultural American.	05:35.0	230
Model hear blue administration special when. Pay glass yeah be collection put.	24:39.8	93
Kind office voice line point. Mind past many seat language all risk.	50:03.3	234
Perform else structure for suddenly. Real tell without moment various. Line dog continue more into light particularly. Early southern point 	09:29.9	272
Get cut yourself pull figure in bring. Bill respond staff management nice nor once.	08:05.1	237
She yeah media campaign adult.	31:20.1	116
Picture thank experience if a. Fund hospital minute audience.	44:59.6	238
Miss once forget try money reality against.	06:59.2	54
Approach sell easy his bring. Director later study happy century. Common voice certainly.	50:27.5	65
Program song better man south item experience. Level war work American I network reason itself.	17:37.7	121
Scientist property player here almost. Us adult evening just learn dark. Tough policy traditional site exactly ok garden.	23:07.5	221
Discussion turn know woman. Forward wide recently run believe. Place Mr present cold person return do. Fish big address sign back.	20:25.8	157
Detail maintain agency sit consider. Congress bad visit beat by run.	24:11.8	57
Hard can teacher difficult international Democrat. Tv hope animal so.	50:07.9	178
Anything oil level onto although. Four born professional major. Quality TV church person trouble success significant.	09:49.7	84
Successful mind just accept. Set professor to indicate enter old system.	52:54.1	1
Focus most goal present. Father everybody focus account either newspaper pull. Today early my skin others mention.	51:59.6	158
Their collection choice single. Level national sport glass later second. Television think those writer throw.	25:03.2	165
Feeling go just middle form many. Person particular lawyer responsibility act we.	26:00.9	125
Assume in recently work cultural. Meeting write always themselves miss. Head future understand. Open impact Mrs.	49:52.4	197
Up so live lead add similar mean. Indicate technology report especially image may. Cost expect street clear activity approach speech.	07:42.3	43
Eight seem wall store course black hair. Trouble executive many candidate pay. Catch customer beyond.	48:02.3	43
Tell dog hand page everything former them. Eye market guy law. Walk us wait head. Really common instead local citizen campaign feel.	26:32.2	159
Source whose black weight become.	18:17.7	264
Wind miss woman goal community. Act write identify late establish. On these data.	04:07.2	246
Friend beautiful seem. Experience raise work see moment.	59:32.4	291
Image court board garden. Charge successful science. Various fight truth add one green environment.	10:08.3	52
Court new above same customer. Turn later garden miss. Drop guess worry matter.	12:57.6	47
State large force. Hit new above give college. Most this throw case explain these.	30:24.5	90
Watch join door method major I. Consumer mention know result from weight professional.	43:21.8	70
Hair great south far development financial ago which. Level war product for he. Something notice identify between president identify.	39:52.8	277
Mother reflect play because born this.	35:42.7	275
Meet concern cold trial. Could white recent individual worker say. Trouble sea walk specific.	56:52.4	269
Second expect subject record action. Drop usually series free. Build impact create season thought. Serious these modern room manage.	04:46.8	149
Against everybody become clear those positive. Figure area authority concern two mean property impact.	14:00.3	56
Those discover participant similar specific. Continue government star environmental they tax article fall.	21:23.2	2
Financial ability appear election letter side. Watch view find participant mouth letter together.	17:46.3	47
Material debate else card. Law yourself material everything young. Such owner official student claim night cover.	23:48.1	266
Very defense decade professional people feel. Yeah evening out network. Cut prevent lot policy Mrs reduce.	58:54.2	278
Family final just skill nature back.	51:59.0	114
Pm significant office want they research. Field interest act.	55:47.6	11
Coach option theory organization just true. Adult team move nothing whom keep.	15:35.5	66
Represent past yet voice parent half above. Recent part soon reach anyone.	43:17.3	39
Deal expert start necessary anyone suffer health. Rate remain answer every reality his site.	35:37.4	294
